sentiment,text,data_id
positive,do it yourself save $,6
positive,Easy part replacement and back to dry clothes!,6
positive,This is a great product. It’s better than the dryer trap that came from the original manufacture,6
positive,Good,6
negative,Outlets is 5/16 OD my line was 1/4 OD but one trip to the hardware store for some line and a reducer works fine so far,6
positive,They fit my Kenmore refrigator perfect. I got two of them for the cost of one and a half from!,6
positive,Replaced the metal blower wheel on a bathroom fan.  It is lighter than the metal one and has less of a balance issue.  It works good and is also quiet.,6
positive,This is the correct replacement for the filter in my refrigerator. It was easy to install. No issues.,6
positive,Product was good replacement. I had a question and it was answered quickly. It looks like the problem has been fixed.,6
positive,just great,6
positive,Love it,6
positive,"I ordered this to fix my dishwasher that was not filling with water. I was hoping this is all I would needs it was a pain to get the old one out but that is a dishwasher thing, not related to this part. It works great and once I got the part replaced and everything back together my dishwasher was up and running better then ever. Saved me a ton of money. If a mom in her 40's can do it with some help for YouTube anyone can!",6
positive,"Direct replacement with stainless steel axles, hoping they will last longer than OEM.  Rated durability in the middle since only time will tell.  Instructions would have been helpful to get the optimum order of assembly to save time.  One clip type did not fit on either wheel set due to flashing remaining on the wheel piece.  Used the original clip to enable fit.",6
positive,"The dryer was on its way to the crusher but I figured ""one last try"".  Turns out this was an easy component swap.  Take the back off the dryer, unhook the wires, make the swap ............ zip, bam, boom, new dryer! (well almost).  But I saved a load of cash.",6
positive,I love it,6
positive,Just as advertised,6
negative,These are not good. I use them in a 2.0 and water spills all over and around the filter rather than through it. Resulting code is not good. I'll spend more for a couple that are better made.,6
negative,"I bought a similar model in 2005 with the ""self cleaning"" feature.  I used the self-cleaning feature a few days ago and am now left with a broken oven.  The self-locking door malfunctioned and now I cannot open the door at all.  The oven door is stuck in the locked mode and even turning off the electricity to it will not reset the stove.  My oven is ""no longer covered under warranty"" and Whirlpool refuses to pay for anything, even though the door lock mechanism is obviously defective.  I researched online to find that this is not an uncommon problem as many forums showed the same issue.  The posts state the problems were that the switch's wire either got disconnected or was melted during the self cleaning due to the high temperatures.  I am only able to use the cooktop right now, and even that is frustrating as the stove continuously beeps every two minutes due to the error code from the lock mechanism.  Buyers beware, Whirlpool also owns the following brands: Amana, Maytag, KitchenAid, Roper, Estate, Magic Chef, and Jenn-Air.",6
positive,"Great price, great taste and super easy to install in under 5 seconds.",6
positive,fixed my fridge!,6
positive,Worked great,6
positive,Fit perfectly for my LG fridge. Would recommend & purchase again.,6
positive,"The only downside to this product I've found is the flimsy plastic lid hinge; no matter how gentle you are using and cleaning it, eventually it tears off. I continue to use the two pieces separately, but after a while, the mesh<br />basket gets gunked up with enough coffee residue to call for a replacement. That's even if you clean it thoroughly.<br />I never tried tossing it in the dishwasher, figuring that might reduce its lifespan even more. A pretty affordable<br />option though, I'd say. My last 4-pack of these lasted well over a year, being used 3-4 times daily....",6
negative,"This product is poorly manufactured. Failed after four months. Manufacturer knows about but continues to sell defective item. Beware. Also not that other ""UPDATED"" versions are available for more money.",6
positive,delivery was fast and had it installed in my kureig in no time. Does help with the taste of my coffee in my opinion,6
negative,"I have had this for about two weeks and it works great. With five family members who all like the “good ice” it keeps up with all of us getting a refill throughout the day. Just make sure to run a minimum of 8 baskets of ice on first use to get the plastic taste out of the ice.<br /><br />Pros: large basket for ice, good soft feel to the chew. Easy to use.<br /><br />Cons: not quite at all ( think the level of an air fryer on constant use), does show basket full at times when the ice doesn’t fall completely from the dispenser. Price is a bit high but worth every penny if you use it.<br /><br />Update:<br />I am now on my third unit since I purchased this product. It is crap! Do not buy. The customer service is awesome because their product keeps breaking. The newest one I just got yesterday is already freezing up. Can’t wait until Monday to call instead of email. I’m going to see if they will just cut their losses and write me a check for my purchase so they can quit paying for shipping their broken units back to them.",6
negative,"We absolutely do NOT recommend this unit at all. Produced very little ice. Used in a well ventilated under-bar application but output was almost non-existent,  1 tray a day at best.",6
positive,Work well,6
negative,Cant get it to work with Wink.,6
positive,DIYer’s delight. An appliance repair guy quoted 60 to replace the pump after a $95 house call. Save the money if your KitchenAid is not moving water this is an easy replacement.<br />LH,6
positive,Great,6
positive,"I got this for my Samsung RS21FG refrigerator, easy installation and working as expected.",6
negative,"I ordered these for my fridge, as I have ordered other generic filters and have been quite happy with the value.  However, regarding these filters.  The first filter never really came up to a decent flow rate.  I left in in for 3 days, but my family was exasperated with the fill time - about a minute to fill a glass of water.  That's just not going to cut it.  So I swapped it out with another - no flow rate.  Swapped it out with the third - again no flow.  Three filters, none really worked.  Ordered a different brand of generic, one I had used before.  Amazon shipped to me the next day and that solved the problem.  However, now to get a refund I need to return the used filters?  Why do I need to send three water logged filters that never worked back for a refund?<br /><br />Could not be more disappointed with the purchase.",6
positive,All is good. Received product on time. This is the second time I've ordered this product. I would give 5 stars but the water flow seems slower and I've followed the instructions to mitigate that. It still works to satisfaction though.,6
positive,"This is solidly made and performs quite well.  I love that there are measurement markings on the inside because I rely on them everyday.  The screen is good quality and does not allow large grinds through but it is a single screen and there is no way to replace it.  That surprised me but I had read so many reviews when researching that I probably &#34;assumed&#34; it too had multiple screens.  Don't get me wrong, it does not need anything more than the one but since I cannot loosen a screw to clean it, it requires a little bit of attention to be sure all grinds have been removed in the cleaning process; not a big deal as it only requires rinsing it thoroughly and that is easy to do.  This pot is handsome enough to leave out and does a very good job of producing quality coffee.  The clip-on spoon is also made well but I soon abandoned it in favor of weighing my grinds to my chosen 11 grams per cup.",6
positive,"We use this product on a daily basis along with another Laundry Alternative product the Nina Spin Dryer. Both products work great and seamlessly together. Tips when using the Wonderwash is to use 2 tbsp of Tide powder and 1 tbsp of Oxi Clean per full load along with to pitchers full of HOT water this machine works via steam pressure. We spin the washer several times, wait thirty minutes to soak, spin again several times, empty and repeat twice with detergent once without. Our clothes are very clean everything from my husband's work pants to dirty cloth diapers. This is so much easier for me as a pregnant woman than the ole plunger bucket method and it is much more effective in cleaning our clothes thoroughly. One full load is roughly 3 towels, 2 men's pants, and 4 shirts.",6
negative,"I was searching for a better value 4396508 replacement filter for my older Whirlpool ED5VHGXML10 refrigerator and decided to give this one a try.  Out of the box, the IcePure water filter looked identical to my Clear Choice ClCH100 water filter but when I tried to twist it quarter turn to lock in the filter, it would never twist on.  In examining the heads more carefully, you can see there are minor variations. But these minor variations kept my filter from twisting in.  I had to return it and get my original Clear Choice CLCH100 water filter.",6
positive,Product was an exact match for my freezer and works great,6
positive,New refrigerator and wasn't sure of the filter needed and/or how difficult the filter could be installed. Easy to install and confident on the ordering process. Set up on subscription ordering so I don't forget to change; and I can do it myself.,6
positive,I like everything about this except the used look and the hose leaking,6
positive,I really like them.  A little bit of work to make them hold more coffee grounds but well worth it.  Saves lot of trouble at clean up.  I recommend them if you are not keen to buying the K-cups all the time.  I sent my sister a box and she loves them as well.,6
positive,"I now have a large supply of filters for half the price I used to pay at the supermarket (for the exact same product)!  Awesome bargain!  Easy to store, doesn't take up a lot of space, unbleached, biodegradable...the used filters get tossed right into my compost bucket.  Doesn't get any easier than that!  I would definitely recommend making the initial investment to have these on hand, its quite a savings in the long run.",6
positive,Gave as an engagement gift couple had no ice maker in freezer. They absolutely love it I think it’s the best gift they got. Makes ice fast no more running to store to buy ice for them.,6
positive,Easy to install.  Same profile as the freezer door.  Slightly cooler color. Great deal!  Significantly less expensive that the replacement handle from Frigidaire.,6
negative,"I have owned an LG French Door refridgerator for over 2 years now. I've had to replace a shelf unit in it 3x.  The shelf that holds the vegetable crispers does not have stability and when the weight of the veggie crispers causes the center section to sag, eventually cracking the plastice frame around the shelf.<br /><br />I've called LG and they say that since it is out of warranty, they cannot do anything.  The parts company says the only solution is to keep reordering the part.  I've had to put folded towels under the crispers to give the unit more stability.  Should that be necesarry on a 2 year old unit that costs over $1500???<br /><br />The style of the fridge is great.  Lots of room, deep door pockets.  The shelves are a bit of a problem, lots of wasted airspace as there is limited shelf height adjustment. I would look at other brands if you like the french door style refridgerator.  Our neighbors bought a Whirlpool and have not had any problems.  A friend has the same LG fridge in stainless steel and is not happy with it at all.<br />Shame on LG for not offering assitance to customers on these refridgerators. I will not buy anymore LG products.",6
positive,Works,6
positive,All went well.  No issues.,6
negative,"Didn't work,  broke in a month",6
positive,Great product.,6
positive,I already submitted a review.,6
positive,Dryer works wonders,6
positive,"Wash machine stopped spinning in both the wash and spin cycles. I recall that when it happened in past years, it cost $200 for the repairman to correct the problem. This time, I Googled the problem to see if the repair was something we could handle on our own. I was surprised to find (a) the repair was easy, and (b) the part cost less than $15.00 (with free delivery from Amazon Prime)! Online sites showed short videos of how to open the machine and replace this belt. The washer now works like new!",6
positive,Great quality.  I was exactly what I needed!,6
positive,Cheap and good,6
positive,This little fan is great.  Quiet and really can move some air!,6
positive,"Works as good as the Samsung, and it doesn’t come from China!",6
positive,"I bought this machine from another retailer but thought I needed to review it as the other review for this item, I feel is unfair. HE Machines use very little water but this thing has my clothes cleaner than any other washing machine I've ever owned. The agitator feature is a rarity nowadays and I appreciate finding one in this washer. I love how awesome it is, it has auto sensing features as well as deep fill options, the (volume controlled) chimes are extremely useful in letting me know when the loads are done and having a glass top is an added bonus. My only complaint is the slight curved top but its helping me learn to put my clothes away instead of just leaving them on top of the machine. If you're looking for a good mid range washer, I highly suggest considering this one, it is awesome!",6
positive,Given as a gift to my daughter; she was pleased especially the feature of no heat-up time.,6
positive,Works Fine,6
negative,"I am an appliance repair technician, i installed one of these in a dryer and it lasted 12 days before it shorted out, i would avoid buying this inferior junk heater.",6
positive,Great buy.,6
positive,FAST DELIVERY AND AS ADVERTIZED,6
positive,Easy to install.,6
negative,MR. COFFEE Boxes were open and damage.,6
positive,"This was exactly what I needed. I can't understand why a $1300 dishwasher comes with cheesy plastic wheel spindles that always break. These new parts are so much more sturdy. No instructions included, but work slowly on one side at a time using the other side for reference and you'll be fine.",6
positive,Exactly what I ordered for my 25 yr old Maytag oven. Works great! Came the next day.,6
positive,"I purchased this machine after my GE Opal nugget machine died.  This machine was about half the price and so far works just as well.<br /><br />Pros: Super easy set up.  Literally, fill with water and plug it in.  Soft chewable ice ready in about 15 minutes.  Price was right.<br /><br />Cons: The height of the ice maker is about an inch too tall to fit on my counter top/beneath upper cabinets.  So I have it set up on my kitchen table.  This will only be an issue on holidays when I have extra family at the house.  Second Con is that the machine is tall and thin so the bucket that catches fills to the point that when you scoop ice you almost always drop a few nuggets and have to hunt them on the floor",6
positive,Easy to install and provides great water flavor.,6
negative,Bought this ice machine back in June 2020 and it stopped working. Watch a few youtube videos tried a couple things but no such luck.,6
positive,Works for the humidifier below.,6
negative,I ordered a 3 pack and all of them leaked,6
positive,"I've only had it for 3 days and this is the first day I used it. I did a medium sized load of clothes with pajamas and bras a pair of socks, two lightweight tops,and a slip.  It took more time to ring the clothes than it did to wash it. Wash clothes very well. I loaded it with water instead of using the hose because I wanted to use it in my room where I had an outlet for it.  I just put it on the floor and it worked great. I don't have a big washer and I hate going to the laundromat where everybody's kids is climbing on the tables and everything, so for medium sized and smaller things this works great . I can even put my jumpsuits and long dresses in it because they are lightweight.",6
negative,Worked great for several weeks then quit working. Do not buy this ice maker!,6
positive,nice filters only concern is quality of paper....chemicals? dont know,6
positive,This item worked perfectly for my refrigerator.,6
positive,I bought 2 pairs. One pair went on fridge and the other went on my stove. I have a double oven. These really stand out. A little loose on the fridge but no biggie.,6
positive,"These are the quintessential and best filters for your Moccamaster. Many times brands will just rebadge products to ""fit"" their products but that is not the case with these filters. They are the best I've ever used.<br /><br />I love that they are unbleached and will not effect the flavor of your amazing drip coffee. Just to be sure, I always make sure to wet the filters before use with hot water (this makes sure any other flavors are diminished). Make sure you fold the bottom and side along the perforation before use to fit the Moccamaster brew basket perfectly.",6
positive,"Works great, just as advertised.",6
positive,Good price worked right,6
negative,"The oven arrived exactly as described however, it doesn't cook well.  After reading all the instructions and following what was written I find that they are inadequate.  I have tried making cookies, it took over an hour for them to bake.  Next I tried to make a rotisserie  chicken, again following the instructions, after 1 hour it was still raw!  I have contacted the company twice but they have let me know it has been longer than 30 days,purchased in 6/28/18, and I am no longer able to return.  I would not recommend this product.  The door is so hot that I have burned myself multiple times just trying to shut the door.",6
positive,"If you are looking for a very economical ice maker that does the job as well as expensive ones would, then this is your best choice. It's very compact, we can even take it to our camping trips and joy iced drinks. It makes ice so fast you wouldn't even notice that your ice is ready. It's a good investment all in all and I highly recommend it. By the way, we've had it for years and it still works as good as the first time.",6
positive,This is high quality and easy to use.,6
positive,Very Happy with these item will order again,6
positive,they work well... would buy again,6
positive,So far so good.,6
positive,"works like a champ washing is working perfectly! have not had a problem Work fixed our washing with no problem and only spent $11,00",6
positive,"I give this before because it works really well now that I've installed it with the adapters that I had to buy. It didn't fit my oven like it said it would, but I found a place in town that had adapters and I made it work. After I got it installed, it has worked perfectly",6
negative,Don’t waste your money. I purchased this brand because the other brands were going out so quickly. This one lasted 1 week!,6
negative,"The covers pretty much do what they are supposed to do, but I have 2 main complaints.  They are thicker than I imagined them to be.  It would be nice to have a thinner cover.  Also, when they are attached to the handle with the velcro strips, they do not close completely when wrapped around the handle.  The overlapping side does not attach flush to the other side of the cover, so it sticks out a bit, especially on the ends.  I think having a thinner piece of material would help them stick together better.",6
positive,"Nice, does what it's supposed to do. Very easy to install.",6
positive,"Unpacked it, wiped it down inside and out, waited about an hour before filling the reservoir with filtered water and vinegar for a good clean.  Started timing it to see if it really delivered ice as fast as claimed.  I selected little ones to start and in 13 minutes, I heard ice drop into the reservoir.  The next batch only took 8 minutes.  I kept changing the size of the cubes - largest does take a little longer but not much.  I left it running all night and in the morning, I had a ton of cubes that had not melted.  I added more filtered water to get rid of the vinegar smell and just let it run out.  By the third filling, the ice was perfect.  I purchased this for use by the pool although I don't plan to leave it outside in the sun...and it's going to be a blessing.  My refrigerator icemaker cannot keep up with this unit!  Just hope it holds up.  By the way - I just love the red color!  Too cool!!",6
positive,Great Water Filter for a Great Price,6
negative,"Description stated that this could be installed under a kitchen sink but it cannot, I’m sure it’s a good product but I am not able to use it for what I needed",6
positive,Great replacement motor and simple to install.  Noise level is greatly improved from original 20 year old fan/motor.,6
negative,Very satisfied,6
positive,"Works great, fits on cabinet perfect and makes ice cubes fast.",6
positive,good,6
positive,Work as advertised,6
positive,"The handle didn't fit.  The basket seems a little short in the coffee maker, but the mesh material is a better quality than some.",6
positive,goood product,6
positive,Easy to install,6
positive,Very good product worth the price,6
positive,"Disliked shipping time, but washer has been working well - larger size works better than the last portable washer I had.  Build quality is better than the last portable washer I had.  I would recommend this product, just keep in mind it is not a regular washing machine, so you will be doing smaller loads.",6
negative,flimzy,6
negative,"Bought this to repair a Samsung dryer that burned out the overcurrent  sensor.  Replaced the element, over-temp and overcurrent sensor that came in the pack.  Reassembled (God bless YouTube!) and did a test run.  Seemed fine so did a load of laundry and 2 hours later, damp clothes.  Tore it apart and using my ohm-meter diagnosed the over current sensor was opened, electrically that means its blown like a fuse.  Element tested within spec and no short to ground so no reason for over current.  Contacted customer service and they sent another whole kit.  They did not make me return other parts due to Covid protocols and replacement came very quickly so that is why I gave the 3 stars.  However, same thing with replacement.  Tear apart, replace the parts, re-assemble, test run for a few minutes, believe it was fixed, run laundry, wet clothes.  Blown overcurrent sensor.  Bought from local dealer for a lot more money, but it works.  Odd as its same part#  and looks identical.  Only thing I can think of is that the factory that makes these overseas is selling the ones that  don't pass quality control that the dealers require.",6
positive,Works as expected,6
positive,"This filter works perfectly in our Whirlpool WRX988SIB refrigerator.<br /><br />We purchased a different brand previously and had to deal with continual noise from air left in the system (even after running 5 gallons to clear it).<br /><br />This filter clears air faster after installation and keeps cloudiness (from tiny air bubbles) in the water as well as noise to a minimum. Just be sure to run a good three to five gallons of water through the system after installing it to clear out any charcoal debris and air.<br /><br />Our drinking water and ice are clear, clean and fresh.<br /><br />We just have a two-person household but we still replace the filter every six months as recommended.<br /><br />We also replace our refrigerator's air filter at the same time:<br /><br />[[ASIN:B004DNWVPM Whirlpool W10311524 AIR1 Refrigerator Air Filter]]",6
positive,I love my stand and the rose gold color is beautiful.  This stand prevents me from having to stop typing and just look up to see who is calling or I can use it for video calling so I don’t have to hold my phone.  Wonderful product and I will be purchasing another one.,6
negative,"The machine does not brew good coffee. I have tried for a while, hoping the look and flavor of my coffee would get better. Any cup or tumbler that is used when brewing splashes liquid everywhere. I use Starbucks expresso, but the brewing of the coffee looks and tastes like tea. I have tried various amounts and different k-cups. The results are the same. Its noisy while brewing. I would like a refund. I know that's not possible because it's past the return date. If you don't listen to any other review, please take mine to heart. This is not a good coffee maker.",6
