sentiment,text,data_id
positive,Good.,6
positive,I like how they are lighter in comparison to the thick paper counterpart. They are definitely a great value,6
positive,"This was a all around good product, shipped in great time everything I was expecting. Good job",6
positive,"I’ve wait a while to post my review to make sure it continues to work. Got here pretty quickly and wasn’t as hard as I thought it was going to be to install, did have to take the back panel off my stove in Order to make sure it was installed correctly, also has to be the ends straight as they where in an L shape, but overall only took me about 30 minutes to install and it works great and is still working almost two months later.",6
positive,As expected.,6
positive,These pads provide much needed elevation to my washer (so that I can open the storage compartment blocked by the pan) and seems to calm the vibration when the machine spins.,6
positive,"They aren't heavy duty, like some mentioned, but they work really well.  The price is great and there are 40 of them.  I can even gently rinse them.  My stove is one of those open burner ones, that have big holes, so sometime the edges get a little singed, but they still work very well.",6
positive,Very easy to use.  Very happy with purchase.,6
positive,"Installed easily! Exact fit and the washer is working again flawlessly! Noticed a few people noted that the plastic clip broke, so I took extra caution when installing it and didn't have any problems.",6
positive,Excellent filters for an exact fit~!  They work great.,6
positive,Gracias es excelente Gracias,6
positive,"I loved finding an alternative to the expensive carafe pods for the keurig, as well as eliminating the waste! Out of the box, we ran into a bit of a problem since every time the pod was put in, there was an error message. Since the regular pods come with a big blue circle sticker centered at 9 o'clock, we just rigged a little on using an old regular pod as shown. After that, works great and didn't need a filter. Otherwise this would be a 5 out of 5, maybe send a sticker with it next time.",6
negative,Failed in 4 months.  Made great ice for 31/2 months.  Then the ice cubes started to be frozen together.  Now the unit is rattling all day long.  Waiting for it to stop making ice.  Disappointed !,6
positive,Work just as good as name brands for half the price.,6
positive,It’s cost was the reason I chose this product.  It fits perfect.  Very difficult to open (clean).  If your dexterity isn’t 100% this might not be the best option.,6
negative,"I'm sure they are fine - haven't needed them yet.,",6
negative,"I have yet to use the filter, but feel ripped off already.  Shown as a GE product which I know works well but came as a generic with a poorly attached label.",6
negative,Does not update and LG tech support will not help you unless you are one of the companies work for them like sears,6
negative,Hood had a dent in front when it arrived. Had to return.,6
negative,"It works as intended if you don't let food get dried up on your plates (soak them in your sink as soon as your done eating). I do wish it was a bit taller, you cannot fit dinner plates if you are using the utensil top rack. Not bad for a 1 or 2 person household, saves time especially on glassware.",6
positive,Works great! Our fridge doesn’t have an ice maker so this is convenient.,6
positive,"Replaced my old one... actually lost the old one.  With Prime shipping, it was fast. By the way i didn't know if this would fit but it did... The open dimensions of my dryer were about 1.5 to 11.5 inches... So this thing was a perfect fit for it.",6
positive,Best way to get a grit free coffee.  No grinds ever except the coffee brew itself.  Easy clean-up since all you do is toss the used filter after use .,6
negative,"These worked well for us for a while, but the last 2 we got have drastically slowed the water flow. I've actually gone ahead and ordered the LG filter and it works much better. I think you get what you pay for.",6
positive,Exact match to original part and easy to install.,6
positive,Is as advertised.,6
positive,I just received this item recently and I'm really happy with it. I can tell it's of great quality and will last for a long time. I can't wait to set them up in my yard.,6
positive,Perfect fit for my Keurig. We drink a lot of coffee and have to switch out filters often. This is the most economical way to purchase.,6
positive,The original lasted 11 years. Hopefully this will last longer.,6
positive,"Fit well, tastes good",6
positive,Works great. Will need to defrost every few months depending on how cold you keep it.,6
positive,Great price for the product.,6
positive,This product works perfectly.  My old ice maker was no longer dropping the ice cubes properly causing everything to overfill and freeze solid.  I installed this new unit in about 5 minutes and it corrected my issue!,6
positive,Perfect replacement part; company was very responsive to my questions.,6
positive,"Definitely order the wrong version but for the same purpose? Idk if that makes sense, but I made it work and it fit good. Dishwasher is not moving when washing or when I open the front door to take dishes in/out. No regrets on this purchase!",6
positive,This is a great ice making machine. Easily fits on the counter at my office. It makes ice quickly. It has two size options - large and small ice. Easy to use. Just pour the water in and turn it on. Simple! I've been using it everyday for the past two months without any problems. Seems to be well made. Highly recommend.,6
positive,Works great!,6
positive,Product is exactly as described.,6
positive,"A strong wind blew our exterior door into the inside wall causing a hole in the wall - an impression from the door handle. This was a quick fix to not only hide the hole, but also to avoid it happening again. Hoping the adhesive holds, but there are 5 others in the package.",6
positive,Easy to install works great,6
positive,"Glad I was able to find these replacement parts for our 8 year old dishwasher - did the trick, and seems like they improved the design as well.",6
positive,This is good works good and many pieces of garments,6
positive,great,6
positive,"arrived quickly, packaged well for travel. preforms very well, easy to install",6
positive,"My ice maker quit working after 16 years. A quick youtube search showed me how to jumper the module to test water inlet valve and control module motor. My motor had gone bad so watched another video on replacing control module and ordered this one. Replacing took less than 10 minutes, it really is a DIY job. The new module works well and the ice is flowing again.",6
positive,"Easy install, looks good, lightweight, read electrical instructions",6
negative,Seems same as OEM Auger except machining on shaft a little off and had to be ground a little bit.,6
positive,Great follow up by the company. Makes sure you are satisfied with the product.,6
negative,This is the 2nd time I have ordered this but this time it came dented.,6
positive,I like the eggs holder,6
positive,Affordable and works the same as the high dollar one my Whirlpool refrigerator came with! I will definitely be ordering this again!,6
negative,Does not fit good very loose . Dont waste your money .,6
positive,These filters seem to last pretty long too. I'll keep you posted on the longevity and taste.,6
positive,There ok,6
positive,Capsules made of god quality and i can put any kind of coffee,6
positive,It does it's job.,6
positive,Delivered on time and works great,6
negative,DOES NOT FIT IN TERMADOR FRIDGE.  I bought one previously that worked then ordered two more.  The other two did not fit.  They would not screw in.  I then ordered one directly from Bosch/Thermador and it fit perfectly.,6
positive,works good,6
positive,What a great value,6
negative,The bearing seems to work fine but the outer seal is much too big and wont work.,6
positive,"Arrived slightly bent, I had to rework a couple of sections to install it.",6
positive,Easy to order.  Fulfilled on time and correctly.  The filter fits my Keurig perfectly and the price is fair.  Really can't complain about anything.,6
negative,The colors were washed out and not bright as pictured. It has the correct graphics but not as pictured. It was bought for a young girl and she decided to keep it.,6
negative,"its a key, arrived in less then a week, which was great considering we have a locked freezer we needed to get into.  Its not the right key for us though, could've used a better picture of the key, maybe of the part that matters? A picture of the tip of the key would've been great.",6
positive,Rebuilt my old dryer runs great now bearing noise all gone.,6
negative,I could see that the glue was missing this will cause the filter to collapse making it ineffective. I have a glue gun and ran some glue lines on the filter. It helped a lot,6
negative,Only got about 3 months of use before it failed.,6
positive,Perfect fit for my humidifier. Arrived super fast and packaged very nicely. Highly recommend.,6
negative,The ice maker never worked and cold water never came out. So disappointed that it didn’t function properly,6
positive,luv it,6
negative,it's a cool product but it over fills the canister for the pot so i have to click some out or the grounds overflow and then the lid won't close. it's one scoop or 2 & 1/2 teaspoons.,6
positive,"the portable washing machine is light, works very well, and has very good capacity.",6
negative,They are upside down...,6
positive,"Have had this working perfectly for 3 months, and we do a lot of laundry. Would recommend this.",6
positive,Great for price,6
positive,Only had it for a few days but it is colorless and odorless so I think it is doing its job,6
negative,I bought it my fridge but It was so hard fingir the description and model. I bought it based on the picture but it didn’t fit in our fridge,6
positive,Cute/Practical! You just need to remember to switch from clean to dirty after a load !🤣😵‍💫,6
positive,This pump was an easy install and fixed my draining problem!,6
positive,"[[VIDEOID:2d8bcc784668964c9d9324b64a293f4e]] I have a Samsung top load washer, model # WA50R5200AW, washer tech wanted $400 to do this replacement. I bought these, and spend about an hour replacing them. Watched a video on YouTube. Only help I needed was to hold the top up while I replaced the front two and back right. The back left, I went through the back panel. Was a little more difficult but I got it done.",6
positive,Good value!,6
positive,just what I needed,6
negative,"After inserting the coffee pods the coffee goes everywhere but in the cup.  I've tried numerous types of pods and it's the same problem.  I've also taken it apart and cleaned where the pods go, checked the needle, etc.  No change!  I was on the fence when I ordered this knowing Keurig was probably better but it had some interesting features that the Keurig didn't have....I wish I had gone with my gut.",6
positive,So far so good looks clean and sharp on my stove and counter.I've always been looking for something like this I love it.,6
positive,"Convenient, affordable and easy to install.",6
positive,"Worked great, easy to install.",6
positive,Exactly what was described and is working well,6
positive,Perfect replacement,6
positive,a perfect replacement for more expensive alternatives.,6
positive,over a year and still going,6
positive,Everything was good,6
positive,As my title indicate this filter fit my GE refrigerator perfectly and it seems to be working as it should. I think most people would agree these filters (no matter who makes them) are more expensive than they need to be but that's just the world we live in. I consider these filters a good value all things said and done.,6
positive,Easy to replace after watching a youtube video. Only needed small flat screwdriver and a 1/4&#34; nut driver. Started working soon as applying power. They are a lot higher on them refrigerator parts sites.,6
positive,"Fixed my maytag bravos xl, its like a brand new machine. Very high quality, I never write reviews this was my first one,thats how much I liked this kit would buy again!!!",6
positive,Did the job,6
negative,"I purchased it specifically for my LG stove model number, to protect the top against splashes and spills, It came in 3 sections that overlap in the middle, it did protected the top against a few hot oil splashes, but it was, and is, worthless against spills, the cover is cut too short all around the edges and burners, exposing all the stove top edges and burners, as you can see in the photo, so the first time I had a spill it ran under the covers making the covers useless for the purpose I bought it in the first place, it would have been great if it was one solid piece and long enough to cover the edges all around, so if it was a spill the liquid would remain on top of the cover and not on the stove top",6
negative,I loved this thing for quite a while - worked great but now the sensor is on saying ice full and it won’t make anymore but there’s absolutely no ice in it. Cleaned it and unplugged for awhile and it won’t work anymore at all.,6
positive,I looked all over for knobs that had a longer shaft to accommodate my Jenn Air.  Bought several that did not fit.  These fit!  The set of these was less than one knob from Jenn Air.  the pack recplaced them all and I am extremely happy.  Wish I would have found them earlier!,6
positive,Awesome,6
positive,After reading other reviews about this product I was a bit hesitant! But wanting a new knob with the metal band around the outside would be a great solution!! Well I got it in and slid it on with no issues! This know will now outlive the dryer!!,6
negative,"2nd time buying a replacement heating element, with Blue Stars, first one lasted 6 months, second one lasted only a month.  Avoid this brand.  Pay for what you get.",6
positive,Best value for your money they work and fit perfectly and the company mailed them super fast and are very professional would buy from them again and would highly reccomend,6
positive,Works like the original.,6
negative,"I really hate writing this review because the machine is awesome. It’s small, fits nicely on the counter, quiet, and makes perfect ice. Until it doesn’t. After only six weeks of use, it stopped making ice. We contacted Opal customer service via email and waited a week for a reply. After several emails back and forth to diagnose the problem, we were told the machine needed to be defrosted and given steps to follow. We ran through the defrost and cleaning cycle 8-10 times. No luck, so we contacted customer service again and were told to run a vinegar wash through the machine. Vinegar wash three times, still nothing. Back to customer service via email (the only way to contact the company) to be instructed to clean the sensors. Sensors cleaned, still no ice. At this point it’s been two weeks since we first contacted customer service and we’re a bit frustrated but we reach out again. “You’ll need to purchase the Opal Cleaning Kit, sold on our website.” NO! Replace the darn thing! At nearly $500 it should work longer than 6 weeks and we shouldn’t have to jump through hoops when it breaks. Don’t buy it! You will be held hostage by your love of nugget ice!",6
positive,Now my dryer works again! For less than $10.00!,6
positive,Direct replacement. Maytag bravos xl dryer.,6
positive,works perfect,6
positive,Very easy to install.  I used a hair dryer to heat it lightly (don't get too hot or too close with it) and let it sit overnight in the shape that it will be in when installed. I also found a tutorial online for installation and it was on in a matter of minutes. Frost on the inside edge of the freezer is gone.,6
positive,Replacement for a failing speed control. Installation was easy after watching a couple of videos on YouTube. Works great.,6
positive,"I'm a Turkish/Cowboy coffee guy.<br />For those that don't know what that means, I mix my finely ground coffee directly into hot water, mix and let the grounds sink to the bottom. The Crema is superb. It is seriously the best and most flavorful way to drink a cup of coffee......  That is in My Humble Opinion.....<br /><br />Apparently most people don't like having to worry about the last couple sips containing grounds.<br />The next best thing is a french press or a pour over, but most pour overs use a paper filter which keeps a great deal of the crema from getting into the cup. Not this one, This pour over by HRySer uses a fine Stainless stell screen inside a stainless steel strainer cone.<br /><br />I tested it with my normal super fine ground coffee and it worked perfectly. The coffee was rich and flavorful.<br /><br />I love the way it is designed.<br />I love the way it works.<br />I love the fact that it doesn't use paper filters.<br />I love the fact that I finally have a way to make my girlfriends coffee in the morning!<br /><br />Conclusion:<br />  A great pour over coffee maker that would work in any kitchen (or for camping too)<br /><br />HRYSER provided this coffee maker to GadgetClass for testing and review.",6
positive,"Really improves taste! Does restrict water flow a little,  but worth it.",6
positive,Very nice product - I will be using it to strain broth.,6
negative,I bought this product in hope it would fix my fridge and it didn’t so I don’t know about this product.,6
positive,Good quality. Worked perfect,6
positive,Exactly as described. Perfect fit.,6
positive,"good price , good product !!!",6
positive,Wife loves it compared to metal bowl which split at 6 months old,6
positive,Great product,6
positive,Had to return because water didn't fill up but Amazon had no problem with the return Amazon has always been good to stand by their products and customer satisfaction,6
positive,This washer knob set works great and so much cheaper than the appliance store The knob set came very quickly,6
positive,I can't get a strong enough cup of coffee from my keurig. I can make it stronger than the packs you buy of the coffee but not strong enough to suit me. I think it may just brew a bit too fast. Not the Ekobrew's fault. It's a quality item that I would recommend for anyone that is satisfied with the strength of coffee they get from their Keurig.,6
positive,These will keep your washer from walking across the floor. They really work,6
positive,As good as expected with the right price. 3 for the price of 2,6
negative,Leaks everywhere and the drain hose is tiny making it hard to drain the washer,6
positive,"Arrived early, OEM original part, corrected the problem with the oven.",6
positive,"My oven is 20 years old and after many years of cleaning the old knobs, they started to crumble.  I was glad when I found these.  they fit right in and look great!",6
positive,Quick delivery and very easy to install. Works great! ***Real customer review***,6
positive,Exact fit in comparison to the Samsung filters,6
positive,"it works great and I like that the description of this product was exact,",6
positive,As good as the one it replaced,6
negative,"Unfortunately, after 8 days one of the drawers broke.  The use was very gentle ( there are eggs inside) the quality of the plastic is bad.  Very disappointing.",6
positive,Better than my previous reusable filters.,6
negative,We purchased the machine in October 2016 it just stopped working because the water box assembly cracked. The manufacturer does not make the replacement part and will not return phone calls. I have a 200 dollar door stop. It's crap!,6
negative,It is good but doesn’t remove all the particles.  Easy to use and install,6
positive,It's a reusable filter. Not sure what else to add. But it cleans nicely and serves its purpose.,6
negative,"Fuse broke.... I had to ship this asap, and it broke at the wrong time..",6
positive,Works fine,6
positive,It Works,6
positive,Fit like ome. We have high iron in our well water.  Filter dose a great job of removing rust from kitchen faucet.,6
negative,Clogged my frig. Minimal water output after placing. Ran well once removed. Returned.,6
positive,Definitely got us out of a jam. Great product for the money,6
positive,Been good so far.,6
positive,They were an ok fit.,6
positive,"It’s pretty self-explanatory for the install and fits well. I find I only get about 1.5-2 months worth of use before it needs a change, though!",6
positive,"great product, super fast service !!",6
positive,Works and is so much cheaper than the recommended stuff.,6
negative,"Came in a timely manner. I was very disappointed in the K2V-Cup as it would not work in my Keurig Vue.  When I put in my Keurig, the lid would not close.  I was afraid to press to strongly as I didn't want the lid to break.",6
positive,Well made and exact fit.,6
positive,Very good quality and fit perfect.,6
negative,I odered this because  the description  said it fit my washing machine.  Itdid not fit my machine i had to go  buy new bearings elswhere so i could repair my machine,6
positive,Product works perfectly.,6
positive,Easy to install and saved a ton of money.,6
positive,I truly enjoy using my own coffee in my Keurig occasionally.  These filters with the reusable cups saves on clean up after.  My only concern is the supply can't keep up with the demand.  Haven't been able to get these filters since my first purchase.,6
negative,The filter baskets do what they are supposed to do.  There was no defect in any of them.  The price is a mite high for what they are.,6
positive,I'm happy this product was good and saves us a lot of trouble.,6
positive,Fit perfectly and works great! No more leaks,6
negative,It didn't fit in my furnace. I had to send it back.,6
positive,Love the results of this product. People complement me on my water!,6
positive,Perfect! Thanks!,6
negative,"The two lights went out within two weeks and are very difficult to replace . They sent me the wrong lights to instal which is not easy - had my electrician look at it and told me the parts weren't  right - emailed the information with photos of the parts and my hood to customer service 3 times, called a few times as well - so in a nut shell is anything goes wrong you have NO SUPPORT,  The hood works great but it's dark.  go elsewhere.",6
positive,Makes connecting your dryer to the vent a breeze. Wished I’d found this product years ago.,6
positive,Makes a great cup 'a Joe!,6
negative,"While the machine was running, it wouldn't make ice. I followed all setup directions exactly and tried the troubleshooting tips, and still no ice, even after an hour. Shortly thereafter, the machine started making a terrible chemical smell, and it's now a struggle to get the smell out. We have doors and windows open with fans running and are still struggling to rid the house of the smell. It's in the 40s here and we're all cold. I touched something on the ice maker with the smell and I now can't get the smell off my hand",6
positive,Love it and very easy to clean!!!,6
positive,"The replacement for the part w11025984 Rev B tends to be over $100, but having replaced many of these, I know that most of these are the exact same part just with a different shaped plug. You can see in my pictures the old one on the left (with the part number sticker) and the new one I ordered on the right. Everything about the wiring harness (including the sensor) can be swapped, so that's exactly what I did. So instead of paying over $100 for the more expensive part, I bought this one here for $30 or so and then swapped out the wiring harnesses (just plug and play, really) and that was that.<br /><br />Spoiler alert, this is what a lot of appliance repair technicians do as well. Swapping out and using the old harness took me 7 or 8 minutes, most of that was for taking the pictures. I'm not trying to say this his how companies like to rip people off, but most of the internal parts in your $2,000 washing machine and dryer set are usually the exact same as the parts in your $250 set. Before you spend the big money on repairs, take a look at what you have, and then find out what all matched your part numbers, then order the corresponding lower-priced part because (as you can see here) it's the EXACT same thing. The only thing you might have to do is change the wiring harness. 7 or 8 minutes of work sure beats spending an extra $60 or $70 for the same part that just has a different shaped plug.<br /><br />One star taken off because of the unusual ordering process. The first time I ordered this, I received some kneepads. That was... odd, but the return and reorder process was seamless. The next one I got installed perfectly, but the blue side cracked after a few hours where the hose threads are. It just disintegrated as if it was dry rotted. I honestly believe it was just a fluke manufacturing issue. Will updated with 5 stars when I get a good one.",6
positive,Very good,6
negative,Metallic taste and way too much work for the results.,6
positive,"Arrived early. Easy to install. Installation instructions were included.<br />Fair price. Delivery cost a little high, however, I suppose it's the price you pay for great service. If, it doesn't break like the original then I will be fully satisfied. It is adverised as unbreakable.",6
positive,works as advertised and great price.,6
positive,fits as advertised,6
positive,Great product. Fixed my dryer!,6
positive,"This 20 inch dishwasher was a great price and is exactly what we were looking for. Despite the small size it holds lots of dirty dishes, is energy efficient, runs quietly and does a top notch job washing our dishes. The glasses come out sparkly clean and the cutlery as well- which can be a challenge.  It does take a long time to complete the cycle but it is well worth it. Highly recommend.",6
