sentiment,text,data_id
positive,Awesome unit. I hook it up to my sink faucet and can do dishes multiple times a week.<br /><br />UPDATE: Still holding up great 1 year later.,6
negative,They were paper thin and would not even stand up in filter. 1/4 or less the thickness of the Bettervent filters.  They were advertised as compatible but not name brand.,6
positive,Works,6
positive,It already stopped bread crumbs and sauce from going through the stove crack. I used a little water on a napkin and it was super easy to clean.  My god father has one that's how I got the idea and its a bit shinier and a little thicker have has more of a radius but I like this one better I like that it's flat and matte.  I am upgrading a ton of things around my house and so far this was one of my favorites.,6
positive,Great product!,6
negative,Wasn’t even the right one.,6
positive,Perfect fit and great value,6
negative,although the adhesive is advertised as high heat. The tube warns user &#34;not to use around heat&#34;.,6
negative,"This is our second opal ice machine and the second time we had this exact issue. It works great until it just stops producing ice. We used filtered/distilled water only to ensure maximum use and that didn’t help at all. We cleaned it, rinsed it following the instructions exactly and it still broke. The warranty is only good for 1 year and both of ours broke 18 months in. So we are done with them and their service is horrible. Good luck if you buy this.",6
positive,Works just like the brand name deftly would recommend this product,6
positive,This is an exact replacement for a previous filter. Easy install with an open end and adjustable wrench. The pervious one lasted almost ten years and really needed to be replaced. Nice clean ice again!,6
positive,"Dual temp control is great. Unit isn't the most quiet, but its not noticeably loud. Ours arrived with a dent in the door, but the manufacturer's customer service took great care of us, offering to replace the whole unit or just the door (with simple how to videos to walk us through the process). All things considered, we are pleased.",6
positive,"I really like coffee the way it comes out of the Aeropress. Since I need these filters to make it work, I suppose I like them, too. I buy two or three packs at a time.",6
positive,so far so goo,6
positive,As described. Works fine.,6
positive,Great ice maker!,6
positive,"I love that these are so easy to buy and install. They are great to freshen up the look of the stove. I don't like that the quality is of the standard that they must be replaced if they are scorched in the least of left wet even a little because rust begins quickly so they're designed to create repeat business. I think for that, they should be cheaper!",6
positive,I bought it as a gift for our daughter who has a Keurig and had no idea you could get a k-cup and use your own coffee.,6
positive,Worked just fine,6
positive,"YAY! I mended something!! After 10 years of use, my Kenmore Elite HE4 (same as Whirlpool Duet) dryer stopped heating clothes to dry them. Found the right original part on Amazon for an amazing savings (Sears wanted 2 1/2 times Amazon's price) and repaired my dryer - no appliance repairman bill for me, thank you.",6
positive,Great filter— water tastes great!,6
positive,"perfect fitment, far less expensive than at local lowes. Great product",6
negative,Order W10712394 instead,6
positive,"We have been very pleased with this product. When delivered, it was laid on it’s side despite warnings all over the box to keep it upright. The box was also dented. Customer support contacted us to make sure we had received the ice maker and we explained that we were leaving it upright for a couple of days to make sure it would operate properly. There was a small dent on top but we knew that would be hidden under the counter. It was easy to set up and we had ice in 15 minutes. It is still working very well. Customer service kept communicating with us and made sure it was working properly. They then gave us a partial refund and extended the warranty for a year. Excellent follow through.",6
positive,Replacement for bottom bin on Frigidaire side by side,6
positive,"Great filters, repeat customer",6
positive,exactly what we needed.  timely delivery,6
negative,It wont stay where its supposed to. It keeps coming up,6
negative,It works as designs but is a total ripoff for a cheap charcoal filter.,6
positive,My coffee tastes so strong and I just love it! I let it sit for 5-10 mins after I pour water. But it doesn’t filter that well there are a lot of fine grounds at the bottom.,6
positive,A nice entry-level ice maker for occasional home use. Perfect for my needs.,6
positive,Perfect replacement to fix a frozen ice maker,6
negative,"This is not like the original piece, it's cheap and hallow.  Do not buy.",6
negative,No es muy práctica y es fragil,6
positive,"This item came exactly as described in size, shape, capacity, and material. I have used it to froth milk successfully at least 4 times",6
positive,Perfect belt for our dryer and was easy to install and very reasonable with great shipping time.,6
negative,Coffee was awful,6
positive,Packaging was a little smashed by the time I received it but I got lucky and the product was okay. It was easy to install and it fixed my oven what more could I ask for?,6
positive,will buy again!,6
negative,It was too small for my freezer so I couldn't even use it due to the small ness of it,6
negative,Love the concept of a reusable k-cup but these unfortunately are slightly larger than a stand Keurig cup making it impossible to close the machine. These cups can be used if you manually hold down the machine during brewing however this design flaw is difficult to overlook.,6
positive,works as advertised,6
positive,Good and reasonable cost replacement for the original GE MWF filter.,6
negative,2 of the wheels broke just installing the item.,6
positive,I can not rate Longevity yet.,6
positive,"Keeps the humidifier clean and odor free. It is concentrated, so it only takes a little. The bottle lasts a long time. Just as a warning to those with little ones, The label says this is pretty nasty stuff in it's concentrated form. You don't want to get on your skin or in your eyes. Especially keep it out of the kiddies reach.",6
positive,Works great. Cans are no longer falling out!,6
negative,Stopped making ice after three days.  But the return policy gets 5 stars.,6
positive,Good quality but like most appliances it’s still overpriced,6
positive,Fixed no start problem on washer,6
positive,Love this! Bigger than I thought and it works really well!! Worked for my kitchen faucet perfectly!,6
negative,"Bought it June 21, died last night. No longevity. Worked good other then that.",6
positive,Right knob.,6
positive,After multiple searching; I discovered these wood-tone covers and they matched all the wood counters in our kitchen.  They are pretty sturdy; however I would not put anything real heavy on the metal.  These burner covers are really nice and I have received a lot of compliments.,6
negative,"I loved this ice maker but after around 15 days it started making a horrible noise and stopped making ice. Will be sending back for a refund. I think it’s hit or miss with this machine, it’s so loud. You cannot keep in kitchen because of the dying cat noise it constantly makes when in making ice mode.",6
positive,LOVE MY FRIDGE..... HATED WHEN THE ICE MAKER QUIT.... THIS FIXED IT AFTER READING ALL THE COMPLAINTS ON THE WEB..... GREAT PART TO FIX YOU SAMSUNG,6
positive,Great product,6
positive,Exact fit. Easy to install.,6
positive,"Just a filter, nothing special, works fine",6
positive,Husband absolutely loves this!!!!!,6
positive,house humidification,6
negative,"This is my second Broan humidity sensor switch installed, both have same fatal flaw, erratic funtionality, start runnig randomly at any time of the day regardless of humidity, I have an accurate hygrometer in my bathroom so I know my relative humidity. At times it starts and does not stop even if you press the switch to turn it off. It is a waste of money and engineering brain. I love to tinker with electronics and my conclusion is that they use bad quality components specially the most important one, the humidity sensor. Stay away from this sensor, it is not worth it.",6
positive,Material worked out great for my packaging,6
positive,Filters the water,6
positive,This works great.  Was easy to install.  We have cottonwood trees that the pollen is like cotton batting.  It gets stuck in the ac unit and has caused many around us to fail.  This keeps the cottonwood blossoms out.  I think it will significantly increase the lifespan of our ac unit.,6
positive,fit perfectly and was easy to install Washer is now working normally again,6
positive,Works great I would purchase it again. What i liked most of all was they didn't bloat the price by including unnecessary parts like most others do.,6
positive,No instructions included other than watch the Youtube install video.  It was pretty easy to install and it appears to be much sturdier than the plastic parts they replaced,6
positive,Works perfect!  Totally recommend,6
positive,"Easy to install, great value for the product",6
positive,works fine,6
positive,Easy to install. Works fine.,6
negative,We like our coffee strong and use a French press daily. We were hoping these would make that process easier. Our normally strong coffee is weak at best even after allowing half an hour to steep. Do not recommend for hot French press. Try as a cold brew brew bag.,6
positive,Good item for the price.  Easy to clean. Protects well when frying or with food splatters.,6
positive,I am not sure how the ones I have either get lost or not sure but these replacements are always in my drawer. I have kids and teens so many hands use the dishwasher!,6
positive,I love it and it fills my travel mugs.,6
positive,Professional,6
positive,"This was a great price and s exactly what I needed. I love that it was so much cheaper than buying it at Bed, Bath , and Beyond.",6
positive,This works great!  Provides a mechanism to easily monitor your sticks!!,6
positive, ,6
negative,Quit working in my Kuerig,6
positive,Perfect replacement for an older fan motor from the 80's. Simple and exact replacement. Noise level is very low.,6
positive,Had to replace oven glow bar day two but tech help was outstanding and prompt.Oven works great so far.,6
negative,"TOO MUCH  EFFORT AND TIME TO PUT THEM IN<br />I WENT WITH MR.COFFEE (GENERIC BRAND) TYPE FILTERS-EASIER, QUICKER, AND JUST AS EFFECTIVE<br />I PUNCH A HOLE WITH A SHARPENED POINT PENCIL",6
negative,I bought these to prevent my washing machine from skidding over the new laminate floors we installed. I don't know if my washer isn't heavy enough or these just don't work but my washer is still skidding across the floor in the spin cycle.,6
positive,The size of the replacement was a little smaller than the original. We were apprehensive about the cleaning cycle but it performed successfully without issue.,6
positive,So easy to install and the water was so clear and tasted great. I am happy with my purchase.,6
negative,It has leaked water into the refrigerator since installation. No amount of tweaking or reinstalling has abated this nuisance.,6
positive,What would have been a one hundred dollar repair ends up being less than ten with this item and Youtube.,6
negative,"didn't fit, returned",6
positive,"Looks good, feels sturdy.  Some reviewers complained of a strange smell from their plastic.  No such problem here.  My old basket has some broken bits on the bottom.  So with this one... no more silverwear slipping down through the bottom!  I took off one star because the handle at the top of mine looks like it is ever-so-slightly leaning to one side.",6
negative,Doesnt work and broke my machine!! 😡,6
positive,great and easy,6
positive,Nice looking and easy to install,6
positive,"read the reviews and figured why not... Save like $200 over the OEM part.  I watched a couple of YouTube videos and figured I'm a repair man now!  Installation took no more than 30 mins, I had to cut the plug off the removed part and use the supplied wire nuts to connect it to the replacement part.  Oven fired right up and heated up to 350 in like 12 mins vs. like 1 hour before.  If it fails with in a year or 2 Ill update my review.  Assume no news is good news or my house burnt down and Im dead.... D",6
positive,I ordered wrong part was returned,6
positive,Great product.  Not too wide and keeps the gunk out of the crack that was driving me nuts.  Make sure to measure what size you need.,6
positive,I installed this motor about 8 months ago in our 30 year old Maytag dryer and It's working perfectly.,6
positive,This is the most amazing appliance!!Great quality and easy to hook up!!,6
positive,Absolutely PERFECT...it installed easier then opening the shipping  box....,6
negative,"I will begin by saying this is a beautiful range but has a very loud fan that you cannot turn off and gas burners that are not responsive.  I have had terrible customer service with Frigidaire and Pacific Sales was unwilling to help us when Frigidaire would not.  We only had the range for 11 months, still under manufacture warranty, and sold it to buy a Samsung.<br /><br />The issues we had began back when we received the range in October 2014 from Pacific Sales (Best Buy).  We were unable to use it the first four weeks as we were having construction done in out kitchen.  Once we finally connected it, we noticed that the cooling fan was very loud.  I called Frigidaire and they informed me this was normal but after much discussion agreed to send a tech to look at it.<br /><br />The Tech agreed it was a bit louder than usual and was able to make adjustments to it which made a slight improvement.  But after cooking a standard meal at 400 degrees, the fan would continue to run for 45 minutes after we turned off the oven.  So every time we used the oven, we would eat dinner, clean up, and sit down to watch TV, and the fan would still be running.  And this is not a subtle fan, you must speak loudly to talk over it.  And three days later the fan became very loud again.  I called Frigidaire back and they agreed to send someone to look at it again.  He came out said he needed to order a new fan and would have to set up another appointment.  This was very difficult as my wife was very pregnant and we both had very busy schedules.  He came back a couple weeks later and changed out the fan.  It again sounded a little better but still much too loud and ran much too long after using the range.  This was very annoying, but we could not return it as we were past the two week period.<br /><br />A few weeks later we noticed that one of our burners wasn't very responsive when we adjusted the dial.  I again reached out to Frigidaire and they agreed to send someone to look at it.  I asked if the tech could please bring all of the necessary parts to fix it on the first visit as we now had a small infant and was difficult to plan our schedule.  The tech came and again explained that he would need to order a part and we would need to set up another appointment.  He returned a couple weeks later with the part and slightly improved the burner.<br /><br />We then decided to check all the burners and noticed that none of them are responsive.  For instance, as you turn the dial there seems to be four different settings;  high, medium, low, and very low... but there is no proportional control.<br /><br />I again reached out to Frigidaire and they again sent someone to look at our stove. This time when he looked at it he said that this is typical of a Frigidaire range and there was nothing he could do.  I feel this is unacceptable as the entire purpose of us changing to a gas range was to have better proportional control than an electric range.  Now we had very little control over the temperature while we are cooking at all.<br /><br />I called Frigidaire back at that time to explain that we wanted a different range and they told me there was nothing they can do unless the tech considered it unrepairable.  In my eyes it was unrepairable because there's no proportional control over the gas heating element and is also no control over the loud fan that runs for 45 minutes after we are done cooking.  I was informed to leave the oven door open after we finished cooking to reduce the time of the fan running.  That did not sound like a smart solution with an infant learning to crawl, not to mention the excessive heat.  Frigidaire did not agree and once again I moved on as they said there was nothing they were willing to do.<br /><br />Then, about five months later we were cooking and we had F30 error appear and the oven would not work.  I was extremely upset and immediately called Frigidaire again to have it repaired.  They explained that they were completely booked for two weeks and they would see if they could expedite it and would have someone call me back within 48 hours with a sooner time.  After I got off the phone, I realized that the fan was still blowing on the oven and would not turn off.  I eventually unplugged the range and plugged it back in and the fan turned on off.<br />I didn't hear back at 48 hours and after 72 hours I called back they said they had scheduled an appointment for us on September 2.  We had two problems with this.  First of all, that was they original date (two weeks out) that they told me when I originally called and secondly we had were not available that day.  I explained that was not acceptable so they were able to get us an appointment on August 31st.<br /><br />A few days before they were scheduled to come out, my wife was able to turn on the stove and the error was gone.  I canceled the appointment but I know that there was some type of problem in our range computer.  We then noticed that the drawer on the range was not sitting straight and it appears to have a missing screw which was one more thing that irritated us.<br />That is when I decided to go to back to Best Buy to see if there was anything they could do to help us out as Frigidaire was very clear that there was nothing they were willing to do.<br /><br />We had only had this range for 11 months at this point and have already had techs come to our house eight times in an attempt to fix it.  I had spent ours on the phone and had to open our schedules to work around techs to fix a brand new range that we spent $1,600 on.  It is not as if we purchased the least expensive range on the market.  We had problems with the fan, burners, computer, and the drawer, and are completely unsatisfied with this purchase. We had no confidence that this is going to last us for reasonable period of time.  We wanted a refund.<br /><br />I went to back to Best Buy and I spoke to the Pacific Sales manager and explained the many problems I've had with the Frigidaire range we purchased 11 months ago.  I informed him we wanted a refund so we could purchase a different range.  He said he would reach out to Frigidaire and see what he could do.  A customer service rep from Frigidaire emailed me and asked what they could help me with.  I wrote a very long email (similar to this review) and explained everything that had happened.  They suggested that I buy the extended warranty and were unwilling to do anything else.<br /><br />I reached back out to the Pacific Sales Manager and he said he could not do anything about our Frigidaire range, but would give us a great deal on a new range.  But it turned out that his great deal was still more expensive than the same range at Home depot or Lowes.  I asked if could could at least get if for half price, but he said the best he could do was match the price at Home Depot.  We bought a Samsung range at Lowes the next day and it is fantastic.  I will never shop at Pacific Sales or purchase a Frigidaire product again and I suggest you stay away as well.",6
positive,This makes cleaning my glass top stove so easy and actually doesn’t look bad!  Great time saver!!,6
negative,"So these bearings are a very tight fit for the flange for my washer (Samsung wf330anw). So much so I blamed the seller of the flange for selling a defective part, because these bearings fit the original part. The trouble is I was replacing the flange and the larger bearing would not slide on even after lubrication on the new flange. I bought some SRS bearings from yellowhandyman as I did previously on a hunch that maybe the bearings are the problem. Sure enough the SRS bearings slide onto the flange for the old part as well as the new part. Long story short the tolerance on the larger bearing is way too high for Xike. The smaller bearing slides on like a dream. These parts need to slide together during assembly, there is no banging or pressing these parts together.<br />I have taken my machine apart and rebuilt it, so I do have some experience in this matter. If you plan to rebuild be sure to check the fitment of the flange and bearings before committing to a rebuild otherwise you may find yourself in a pickle.",6
positive,"Nice design, easy to install, just as expected.",6
positive,Works great.  OEM REDUCED WATER PRESSURE.  I IMMEDIATELY NOTICED INCREASED WATER PRESSURE AT THE DOOR.  INCREASED WATER PEESSURE WILL GIVE YOU LARGER ICE CUBES SO YOU MAY WANT TO ADJUST YOUR ICEMAKER (IF YOUR REFRIGERATOR ALLOWS).  WATER TASTES GREAT... ICE IS CLEAN WITH NO AFTERTASTE.  VERY SATISFIED.,6
positive,Arrived quick and as expected. Easy to install,6
positive,"I had a few problems with the unit but thanks to excellent customer service from Belle P., these were resolved quickly and satisfactorily. I returned the unit which had the problems and Whyntner sent me a new freezer for free! Belle P. was always quick to respond and resolve issues.",6
positive,As advertised. Repaired cooktop.,6
negative,"They break too easily. It's slightly better tha no filter at all, but I'm going to look around for something better.",6
positive,"Perfect fit! A little shell-shocked at the price of these OEM drawers, but after so many times shutting the refrigerator door while forgetting to close this drawer, we needed a replacement. Works great!",6
positive,"Son bastante útiles para poder utilizar la cafetera con café para hervir, super útiles y muy prácticas.",6
negative,[[VIDEOID:6f36169285a73282cfe076fad829dff5]] The spin stop spinning the second time I used it. 😩😩😩😩 and too late to return it.,6
negative,"Tried this product, the paper is too weak for my pod and they consistently ripped. Doubling up with two per pod fixed the issue but also doubled the cost per pod. Do not recommend.",6
positive,"I was under the impression that the belt had broken after having our machine for 6 years. It was actually the pulley that had broken completely off, and the belt was still in tact. After replacing the pulley, and belt, our machine is now operating and quiet as it was when new! So glad I ordered this product and saved hundreds of dollars.",6
positive,"I like this egg holder for the refrigerator. It protects the eggs and makes it easy to get to them. It has two rubber corners that stick on the back corners to lift it slightly. This allows the eggs to roll down as you take them out the front. There is a lip at the front to keep them from rolling all the way out. It also includes a lid so you can protect the eggs, but also store items on top to save space. However, I wouldn't put anything heavy on it; nothing more than half a pound. Overall it's a sturdy egg holder. Easy to clean.<br /><br />This is a two layer egg container. Each tray holds 18 large chicken eggs. We had a plastic box from an old refrigerator before and it held a lot of eggs, but you couldn't see how many were in there and you had to feel around to see if there were any in there or take the whole thing out to see inside it. It was not a great way to keep eggs. This one is clear and allows you to see how much you have. That is a big plus.<br /><br />The only reason I gave this an overall four stars instead of five is because it does take up shelf space in the refrigerator. As I said above, this can be mitigated by using the top of it to store light items. I'm wondering if instead of designing it to hold three eggs across, it was two eggs across and four stacks instead of two. Perhaps if they had both designs, it could accommodate different ways people utilize their refrigerator shelving. Just a thought and not a big negative.<br /><br />Overall, this egg holder is great. The clear, easy to clean plastic holds the eggs safely without breakage. It allows you to see how many you have. It holds a lot of eggs (which is great if you are cooking and baking a lot of food). The protective cover on top allows you to store other items on top of it. We've been looking for ways to organize our refrigerator and also easily keep tabs on what we have and what we need. This product does both. It's an excellent purchase and worth the money.",6
positive,"Great small washer machine, we went from a size smaller 6 lbs to 8lbs and it makes a big difference. We can put larger loads in, and dryer works really well, also its not as loud as our other one.  Great product !",6
positive,I use the blades for my work in remodeling they work better then other blades I have used in the past<br />I told my friends about the product they want to try them also. I love these blades<br />going to stock up on them. thanks Sonny F.,6
positive,Great for my grandson's breathing,6
positive,Very good cups. The filler is not necessary. Just buy the cups.,6
positive,Original didn't break...lasts great,6
positive,I am so glad that I bought these. Keeping the kitchen clean!,6
positive,For the price good product,6
